{
  "schema": "aether.cloudlink.session-hello.v1",
  "protocol": "aether.cloudlink",
  "message_kind": "session-hello",
  "gateway_id": "33333333-3333-4333-8333-333333333333",
  "credential_binding": {
    "credential_id": "development-binding-17",
    "generation": "3",
    "proof": "fixture-proof-not-a-secret"
  },
  "offered_protocol_versions": ["1.0"],
  "client_nonce": "aaaaaaaaaaaaaaaaaaaaaaaaaaaaaaaaaaaaaaaaaaaaaaaaaaaaaaaaaaaaaaaaaaaaaaaaaaaaaaaaaaaaaaaaaaaaaaaaaaaaaaaaaaaaaaaaaaaaaaaaaaaaaaaaaaaaaaaaaaaaaaaaaaaaaaaaaaaaaaaaaaaaaaaaaaaaaaaaaaaaaaaaaaaaaaaaaaaaaaaa",
  "resume": []
}
